{
  "review_id": "67930975-a6d2-48dc-a920-c2e7b89b6cab",
  "timestamp": "2026-02-13T19:16:32.537316+00:00",
  "target": "symbol-scanner",
  "review_type": "tool_implementation",
  "dimensions": [
    {
      "dimension": "entity_persistence_pattern",
      "weight": 0.2,
      "status": "pass",
      "score": 5,
      "findings": []
    },
    {
      "dimension": "output_schema_envelope",
      "weight": 0.2,
      "status": "pass",
      "score": 5,
      "findings": []
    },
    {
      "dimension": "code_conventions",
      "weight": 0.15,
      "status": "pass",
      "score": 5,
      "findings": []
    },
    {
      "dimension": "evaluation_infrastructure",
      "weight": 0.15,
      "status": "pass",
      "score": 4,
      "findings": [
        {
          "severity": "info",
          "rule_id": "PROMPT_EVIDENCE",
          "message": "Prompts missing '{{ evidence }}' placeholder: ['integration.md', 'symbol_accuracy.md', 'import_completeness.md', 'call_relationship.md']",
          "category": "pattern_violation",
          "file": "src/tools/symbol-scanner/evaluation/llm/prompts",
          "recommendation": "Add {{ evidence }} placeholder to prompt templates"
        },
        {
          "severity": "info",
          "rule_id": "OBSERVABILITY_ENFORCED",
          "message": "Evaluation orchestrator does not reference observability/tracing",
          "category": "pattern_violation",
          "file": "src/tools/symbol-scanner/evaluation/llm/orchestrator.py",
          "recommendation": "Integrate shared.observability for LLM interaction logging"
        }
      ]
    },
    {
      "dimension": "blueprint_alignment",
      "weight": 0.15,
      "status": "pass",
      "score": 4,
      "findings": [
        {
          "severity": "info",
          "rule_id": "BLUEPRINT_HAS_EVAL_DATA",
          "message": "BLUEPRINT Evaluation section has no numeric data (scores, percentages)",
          "category": "placeholder_content",
          "file": "src/tools/symbol-scanner/BLUEPRINT.md",
          "recommendation": "Populate Evaluation section with actual metric data"
        },
        {
          "severity": "info",
          "rule_id": "BLUEPRINT_TOOL_REFERENCED",
          "message": "BLUEPRINT.md does not reference tool name 'symbol-scanner'",
          "category": "inconsistency",
          "file": "src/tools/symbol-scanner/BLUEPRINT.md"
        }
      ]
    }
  ],
  "summary": {
    "total_findings": 4,
    "by_severity": {
      "error": 0,
      "warning": 0,
      "info": 4
    },
    "overall_status": "STRONG_PASS",
    "overall_score": 4.65,
    "dimensions_reviewed": 5
  }
}
