{
  "review_id": "b16f9d1a-60c3-465e-ac6b-0c12ec910f6d",
  "timestamp": "2026-02-13T18:05:57.451637+00:00",
  "target": "git-sizer",
  "review_type": "tool_implementation",
  "dimensions": [
    {
      "dimension": "entity_persistence_pattern",
      "weight": 0.2,
      "status": "pass",
      "score": 5,
      "findings": []
    },
    {
      "dimension": "output_schema_envelope",
      "weight": 0.2,
      "status": "warn",
      "score": 3,
      "findings": [
        {
          "severity": "warning",
          "rule_id": "ANALYZE_PATH_NORM",
          "message": "analyze.py does not import path normalization utilities",
          "category": "missing_requirement",
          "file": "src/tools/git-sizer/scripts/analyze.py",
          "recommendation": "Import from shared.path_utils or common.path_normalization"
        }
      ]
    },
    {
      "dimension": "code_conventions",
      "weight": 0.15,
      "status": "pass",
      "score": 4,
      "findings": [
        {
          "severity": "info",
          "rule_id": "FUTURE_ANNOTATIONS",
          "message": "Missing 'from __future__ import annotations'",
          "category": "pattern_violation",
          "file": "src/tools/git-sizer/scripts/__init__.py",
          "recommendation": "Add 'from __future__ import annotations' at top of file"
        },
        {
          "severity": "info",
          "rule_id": "FUTURE_ANNOTATIONS",
          "message": "Missing 'from __future__ import annotations'",
          "category": "pattern_violation",
          "file": "src/tools/git-sizer/scripts/evaluate.py",
          "recommendation": "Add 'from __future__ import annotations' at top of file"
        }
      ]
    },
    {
      "dimension": "evaluation_infrastructure",
      "weight": 0.15,
      "status": "pass",
      "score": 4,
      "findings": [
        {
          "severity": "info",
          "rule_id": "PROMPT_EVIDENCE",
          "message": "Prompts missing '{{ evidence }}' placeholder: ['threshold_quality.md', 'actionability.md', 'size_accuracy.md', 'integration_fit.md']",
          "category": "pattern_violation",
          "file": "src/tools/git-sizer/evaluation/llm/prompts",
          "recommendation": "Add {{ evidence }} placeholder to prompt templates"
        }
      ]
    },
    {
      "dimension": "blueprint_alignment",
      "weight": 0.15,
      "status": "pass",
      "score": 4,
      "findings": [
        {
          "severity": "info",
          "rule_id": "BLUEPRINT_HAS_EVAL_DATA",
          "message": "BLUEPRINT Evaluation section has no numeric data (scores, percentages)",
          "category": "placeholder_content",
          "file": "src/tools/git-sizer/BLUEPRINT.md",
          "recommendation": "Populate Evaluation section with actual metric data"
        }
      ]
    }
  ],
  "summary": {
    "total_findings": 5,
    "by_severity": {
      "error": 0,
      "warning": 1,
      "info": 4
    },
    "overall_status": "STRONG_PASS",
    "overall_score": 4.0,
    "dimensions_reviewed": 5
  }
}
