{
  "review_id": "e8f85ecb-1307-4fb2-a8b4-57441e3b324b",
  "timestamp": "2026-02-13T18:51:50.285013+00:00",
  "target": "scc",
  "review_type": "tool_implementation",
  "dimensions": [
    {
      "dimension": "entity_persistence_pattern",
      "weight": 0.2,
      "status": "pass",
      "score": 5,
      "findings": []
    },
    {
      "dimension": "output_schema_envelope",
      "weight": 0.2,
      "status": "pass",
      "score": 5,
      "findings": []
    },
    {
      "dimension": "code_conventions",
      "weight": 0.15,
      "status": "warn",
      "score": 3,
      "findings": [
        {
          "severity": "info",
          "rule_id": "FUTURE_ANNOTATIONS",
          "message": "Missing 'from __future__ import annotations'",
          "category": "pattern_violation",
          "file": "src/tools/scc/scripts/scoring.py",
          "recommendation": "Add 'from __future__ import annotations' at top of file"
        },
        {
          "severity": "info",
          "rule_id": "FUTURE_ANNOTATIONS",
          "message": "Missing 'from __future__ import annotations'",
          "category": "pattern_violation",
          "file": "src/tools/scc/scripts/directory_analyzer.py",
          "recommendation": "Add 'from __future__ import annotations' at top of file"
        },
        {
          "severity": "info",
          "rule_id": "PEP604_UNIONS",
          "message": "Uses Optional[X] instead of PEP 604 'X | None' syntax",
          "category": "pattern_violation",
          "file": "src/tools/scc/scripts/directory_analyzer.py",
          "recommendation": "Replace Optional[X] with X | None"
        },
        {
          "severity": "info",
          "rule_id": "FUTURE_ANNOTATIONS",
          "message": "Missing 'from __future__ import annotations'",
          "category": "pattern_violation",
          "file": "src/tools/scc/scripts/validate.py",
          "recommendation": "Add 'from __future__ import annotations' at top of file"
        },
        {
          "severity": "info",
          "rule_id": "FUTURE_ANNOTATIONS",
          "message": "Missing 'from __future__ import annotations'",
          "category": "pattern_violation",
          "file": "src/tools/scc/scripts/generate_report.py",
          "recommendation": "Add 'from __future__ import annotations' at top of file"
        },
        {
          "severity": "info",
          "rule_id": "FUTURE_ANNOTATIONS",
          "message": "Missing 'from __future__ import annotations'",
          "category": "pattern_violation",
          "file": "src/tools/scc/scripts/transform.py",
          "recommendation": "Add 'from __future__ import annotations' at top of file"
        },
        {
          "severity": "info",
          "rule_id": "FUTURE_ANNOTATIONS",
          "message": "Missing 'from __future__ import annotations'",
          "category": "pattern_violation",
          "file": "src/tools/scc/scripts/llm_judge.py",
          "recommendation": "Add 'from __future__ import annotations' at top of file"
        },
        {
          "severity": "info",
          "rule_id": "PEP604_UNIONS",
          "message": "Uses Optional[X] instead of PEP 604 'X | None' syntax",
          "category": "pattern_violation",
          "file": "src/tools/scc/scripts/llm_judge.py",
          "recommendation": "Replace Optional[X] with X | None"
        },
        {
          "severity": "info",
          "rule_id": "FUTURE_ANNOTATIONS",
          "message": "Missing 'from __future__ import annotations'",
          "category": "pattern_violation",
          "file": "src/tools/scc/scripts/evaluate.py",
          "recommendation": "Add 'from __future__ import annotations' at top of file"
        },
        {
          "severity": "info",
          "rule_id": "FUTURE_ANNOTATIONS",
          "message": "Missing 'from __future__ import annotations'",
          "category": "pattern_violation",
          "file": "src/tools/scc/scripts/error_analyzer.py",
          "recommendation": "Add 'from __future__ import annotations' at top of file"
        },
        {
          "severity": "info",
          "rule_id": "PEP604_UNIONS",
          "message": "Uses Optional[X] instead of PEP 604 'X | None' syntax",
          "category": "pattern_violation",
          "file": "src/tools/scc/scripts/error_analyzer.py",
          "recommendation": "Replace Optional[X] with X | None"
        }
      ]
    },
    {
      "dimension": "evaluation_infrastructure",
      "weight": 0.15,
      "status": "pass",
      "score": 4,
      "findings": [
        {
          "severity": "info",
          "rule_id": "PROMPT_EVIDENCE",
          "message": "Prompts missing '{{ evidence }}' placeholder: ['risk.md', 'code_quality.md', 'api_design.md', 'comparative.md', 'statistics.md', 'directory_analysis.md', 'edge_cases.md', 'documentation.md', 'error_messages.md', 'integration_fit.md']",
          "category": "pattern_violation",
          "file": "src/tools/scc/evaluation/llm/prompts",
          "recommendation": "Add {{ evidence }} placeholder to prompt templates"
        },
        {
          "severity": "info",
          "rule_id": "OBSERVABILITY_ENFORCED",
          "message": "Evaluation orchestrator does not reference observability/tracing",
          "category": "pattern_violation",
          "file": "src/tools/scc/evaluation/llm/orchestrator.py",
          "recommendation": "Integrate shared.observability for LLM interaction logging"
        }
      ]
    },
    {
      "dimension": "blueprint_alignment",
      "weight": 0.15,
      "status": "pass",
      "score": 4,
      "findings": [
        {
          "severity": "info",
          "rule_id": "BLUEPRINT_HAS_EVAL_DATA",
          "message": "BLUEPRINT Evaluation section has no numeric data (scores, percentages)",
          "category": "placeholder_content",
          "file": "src/tools/scc/BLUEPRINT.md",
          "recommendation": "Populate Evaluation section with actual metric data"
        }
      ]
    }
  ],
  "summary": {
    "total_findings": 14,
    "by_severity": {
      "error": 0,
      "warning": 0,
      "info": 14
    },
    "overall_status": "STRONG_PASS",
    "overall_score": 4.29,
    "dimensions_reviewed": 5
  }
}
