{
  "review_id": "ca93997f-a53a-4ad8-80f5-c44979c2cc76",
  "timestamp": "2026-02-13T18:05:57.265628+00:00",
  "target": "sonarqube",
  "review_type": "tool_implementation",
  "dimensions": [
    {
      "dimension": "entity_persistence_pattern",
      "weight": 0.2,
      "status": "pass",
      "score": 5,
      "findings": []
    },
    {
      "dimension": "output_schema_envelope",
      "weight": 0.2,
      "status": "warn",
      "score": 3,
      "findings": [
        {
          "severity": "warning",
          "rule_id": "ANALYZE_PATH_NORM",
          "message": "analyze.py does not import path normalization utilities",
          "category": "missing_requirement",
          "file": "src/tools/sonarqube/scripts/analyze.py",
          "recommendation": "Import from shared.path_utils or common.path_normalization"
        },
        {
          "severity": "info",
          "rule_id": "ANALYZE_CLI_ARGS",
          "message": "analyze.py does not use add_common_args or define sufficient CLI arguments",
          "category": "pattern_violation",
          "file": "src/tools/sonarqube/scripts/analyze.py",
          "recommendation": "Use common.cli_parser.add_common_args for standard CLI arguments"
        }
      ]
    },
    {
      "dimension": "code_conventions",
      "weight": 0.15,
      "status": "warn",
      "score": 3,
      "findings": [
        {
          "severity": "info",
          "rule_id": "FUTURE_ANNOTATIONS",
          "message": "Missing 'from __future__ import annotations'",
          "category": "pattern_violation",
          "file": "src/tools/sonarqube/scripts/scanner.py",
          "recommendation": "Add 'from __future__ import annotations' at top of file"
        },
        {
          "severity": "info",
          "rule_id": "FUTURE_ANNOTATIONS",
          "message": "Missing 'from __future__ import annotations'",
          "category": "pattern_violation",
          "file": "src/tools/sonarqube/scripts/llm_evaluate.py",
          "recommendation": "Add 'from __future__ import annotations' at top of file"
        },
        {
          "severity": "info",
          "rule_id": "FUTURE_ANNOTATIONS",
          "message": "Missing 'from __future__ import annotations'",
          "category": "pattern_violation",
          "file": "src/tools/sonarqube/scripts/__init__.py",
          "recommendation": "Add 'from __future__ import annotations' at top of file"
        },
        {
          "severity": "info",
          "rule_id": "FUTURE_ANNOTATIONS",
          "message": "Missing 'from __future__ import annotations'",
          "category": "pattern_violation",
          "file": "src/tools/sonarqube/scripts/export.py",
          "recommendation": "Add 'from __future__ import annotations' at top of file"
        },
        {
          "severity": "info",
          "rule_id": "FUTURE_ANNOTATIONS",
          "message": "Missing 'from __future__ import annotations'",
          "category": "pattern_violation",
          "file": "src/tools/sonarqube/scripts/evaluate.py",
          "recommendation": "Add 'from __future__ import annotations' at top of file"
        },
        {
          "severity": "info",
          "rule_id": "FUTURE_ANNOTATIONS",
          "message": "Missing 'from __future__ import annotations'",
          "category": "pattern_violation",
          "file": "src/tools/sonarqube/scripts/docker_lifecycle.py",
          "recommendation": "Add 'from __future__ import annotations' at top of file"
        },
        {
          "severity": "info",
          "rule_id": "FUTURE_ANNOTATIONS",
          "message": "Missing 'from __future__ import annotations'",
          "category": "pattern_violation",
          "file": "src/tools/sonarqube/scripts/analyze.py",
          "recommendation": "Add 'from __future__ import annotations' at top of file"
        }
      ]
    },
    {
      "dimension": "evaluation_infrastructure",
      "weight": 0.15,
      "status": "pass",
      "score": 4,
      "findings": [
        {
          "severity": "info",
          "rule_id": "OBSERVABILITY_ENFORCED",
          "message": "Evaluation orchestrator does not reference observability/tracing",
          "category": "pattern_violation",
          "file": "src/tools/sonarqube/evaluation/llm/orchestrator.py",
          "recommendation": "Integrate shared.observability for LLM interaction logging"
        }
      ]
    },
    {
      "dimension": "blueprint_alignment",
      "weight": 0.15,
      "status": "pass",
      "score": 5,
      "findings": []
    }
  ],
  "summary": {
    "total_findings": 10,
    "by_severity": {
      "error": 0,
      "warning": 1,
      "info": 9
    },
    "overall_status": "STRONG_PASS",
    "overall_score": 4.0,
    "dimensions_reviewed": 5
  }
}
