{
  "review_id": "261af113-1420-4136-83f8-04512a879c54",
  "timestamp": "2026-02-13T18:05:57.621930+00:00",
  "target": "gitleaks",
  "review_type": "tool_implementation",
  "dimensions": [
    {
      "dimension": "entity_persistence_pattern",
      "weight": 0.2,
      "status": "pass",
      "score": 5,
      "findings": []
    },
    {
      "dimension": "output_schema_envelope",
      "weight": 0.2,
      "status": "warn",
      "score": 3,
      "findings": [
        {
          "severity": "warning",
          "rule_id": "ANALYZE_PATH_NORM",
          "message": "analyze.py does not import path normalization utilities",
          "category": "missing_requirement",
          "file": "src/tools/gitleaks/scripts/analyze.py",
          "recommendation": "Import from shared.path_utils or common.path_normalization"
        }
      ]
    },
    {
      "dimension": "code_conventions",
      "weight": 0.15,
      "status": "pass",
      "score": 4,
      "findings": [
        {
          "severity": "info",
          "rule_id": "FUTURE_ANNOTATIONS",
          "message": "Missing 'from __future__ import annotations'",
          "category": "pattern_violation",
          "file": "src/tools/gitleaks/scripts/secret_analyzer.py",
          "recommendation": "Add 'from __future__ import annotations' at top of file"
        },
        {
          "severity": "info",
          "rule_id": "FUTURE_ANNOTATIONS",
          "message": "Missing 'from __future__ import annotations'",
          "category": "pattern_violation",
          "file": "src/tools/gitleaks/scripts/__init__.py",
          "recommendation": "Add 'from __future__ import annotations' at top of file"
        },
        {
          "severity": "info",
          "rule_id": "FUTURE_ANNOTATIONS",
          "message": "Missing 'from __future__ import annotations'",
          "category": "pattern_violation",
          "file": "src/tools/gitleaks/scripts/create_synthetic_repos.py",
          "recommendation": "Add 'from __future__ import annotations' at top of file"
        }
      ]
    },
    {
      "dimension": "evaluation_infrastructure",
      "weight": 0.15,
      "status": "pass",
      "score": 4,
      "findings": [
        {
          "severity": "info",
          "rule_id": "OBSERVABILITY_ENFORCED",
          "message": "Evaluation orchestrator does not reference observability/tracing",
          "category": "pattern_violation",
          "file": "src/tools/gitleaks/evaluation/llm/orchestrator.py",
          "recommendation": "Integrate shared.observability for LLM interaction logging"
        }
      ]
    },
    {
      "dimension": "blueprint_alignment",
      "weight": 0.15,
      "status": "pass",
      "score": 4,
      "findings": [
        {
          "severity": "info",
          "rule_id": "BLUEPRINT_HAS_EVAL_DATA",
          "message": "BLUEPRINT Evaluation section has no numeric data (scores, percentages)",
          "category": "placeholder_content",
          "file": "src/tools/gitleaks/BLUEPRINT.md",
          "recommendation": "Populate Evaluation section with actual metric data"
        }
      ]
    }
  ],
  "summary": {
    "total_findings": 6,
    "by_severity": {
      "error": 0,
      "warning": 1,
      "info": 5
    },
    "overall_status": "STRONG_PASS",
    "overall_score": 4.0,
    "dimensions_reviewed": 5
  }
}
