{
  "review_id": "91371366-fbce-4003-9e76-c03ea63cf55a",
  "timestamp": "2026-02-13T19:13:51.151811+00:00",
  "target": "layout-scanner",
  "review_type": "tool_implementation",
  "dimensions": [
    {
      "dimension": "entity_persistence_pattern",
      "weight": 0.2,
      "status": "pass",
      "score": 5,
      "findings": []
    },
    {
      "dimension": "output_schema_envelope",
      "weight": 0.2,
      "status": "pass",
      "score": 5,
      "findings": []
    },
    {
      "dimension": "code_conventions",
      "weight": 0.15,
      "status": "pass",
      "score": 5,
      "findings": []
    },
    {
      "dimension": "evaluation_infrastructure",
      "weight": 0.15,
      "status": "pass",
      "score": 5,
      "findings": []
    },
    {
      "dimension": "blueprint_alignment",
      "weight": 0.15,
      "status": "pass",
      "score": 5,
      "findings": []
    }
  ],
  "summary": {
    "total_findings": 0,
    "by_severity": {
      "error": 0,
      "warning": 0,
      "info": 0
    },
    "overall_status": "STRONG_PASS",
    "overall_score": 5.0,
    "dimensions_reviewed": 5
  }
}
