{
  "review_id": "109f10f4-37d9-4e6f-abcd-710d21e738dd",
  "timestamp": "2026-02-13T18:51:35.167826+00:00",
  "target": "dotcover",
  "review_type": "tool_implementation",
  "dimensions": [
    {
      "dimension": "entity_persistence_pattern",
      "weight": 0.2,
      "status": "pass",
      "score": 5,
      "findings": []
    },
    {
      "dimension": "output_schema_envelope",
      "weight": 0.2,
      "status": "pass",
      "score": 5,
      "findings": []
    },
    {
      "dimension": "code_conventions",
      "weight": 0.15,
      "status": "pass",
      "score": 4,
      "findings": [
        {
          "severity": "info",
          "rule_id": "FUTURE_ANNOTATIONS",
          "message": "Missing 'from __future__ import annotations'",
          "category": "pattern_violation",
          "file": "src/tools/dotcover/scripts/__init__.py",
          "recommendation": "Add 'from __future__ import annotations' at top of file"
        }
      ]
    },
    {
      "dimension": "evaluation_infrastructure",
      "weight": 0.15,
      "status": "pass",
      "score": 4,
      "findings": [
        {
          "severity": "info",
          "rule_id": "PROMPT_EVIDENCE",
          "message": "Prompts missing '{{ evidence }}' placeholder: ['integration.md', 'accuracy.md', 'false_positive.md', 'actionability.md']",
          "category": "pattern_violation",
          "file": "src/tools/dotcover/evaluation/llm/prompts",
          "recommendation": "Add {{ evidence }} placeholder to prompt templates"
        },
        {
          "severity": "info",
          "rule_id": "OBSERVABILITY_ENFORCED",
          "message": "Evaluation orchestrator does not reference observability/tracing",
          "category": "pattern_violation",
          "file": "src/tools/dotcover/evaluation/llm/orchestrator.py",
          "recommendation": "Integrate shared.observability for LLM interaction logging"
        }
      ]
    },
    {
      "dimension": "blueprint_alignment",
      "weight": 0.15,
      "status": "pass",
      "score": 4,
      "findings": [
        {
          "severity": "info",
          "rule_id": "BLUEPRINT_HAS_EVAL_DATA",
          "message": "BLUEPRINT Evaluation section has no numeric data (scores, percentages)",
          "category": "placeholder_content",
          "file": "src/tools/dotcover/BLUEPRINT.md",
          "recommendation": "Populate Evaluation section with actual metric data"
        }
      ]
    }
  ],
  "summary": {
    "total_findings": 4,
    "by_severity": {
      "error": 0,
      "warning": 0,
      "info": 4
    },
    "overall_status": "STRONG_PASS",
    "overall_score": 4.47,
    "dimensions_reviewed": 5
  }
}
