{
  "review_id": "90f13a33-1ec7-416b-81d8-60ab3236b581",
  "timestamp": "2026-02-13T19:16:32.197199+00:00",
  "target": "roslyn-analyzers",
  "review_type": "tool_implementation",
  "dimensions": [
    {
      "dimension": "entity_persistence_pattern",
      "weight": 0.2,
      "status": "pass",
      "score": 5,
      "findings": []
    },
    {
      "dimension": "output_schema_envelope",
      "weight": 0.2,
      "status": "pass",
      "score": 5,
      "findings": []
    },
    {
      "dimension": "code_conventions",
      "weight": 0.15,
      "status": "pass",
      "score": 5,
      "findings": []
    },
    {
      "dimension": "evaluation_infrastructure",
      "weight": 0.15,
      "status": "pass",
      "score": 4,
      "findings": [
        {
          "severity": "info",
          "rule_id": "PROMPT_EVIDENCE",
          "message": "Prompts missing '{{ evidence }}' placeholder: ['security_coverage.md', 'design_analysis.legacy.md', 'false_positive_rate.md', 'detection_accuracy.md', 'security_detection.md', 'resource_management.legacy.md', 'actionability.md', 'overall_quality.legacy.md', 'security_detection.legacy.md']",
          "category": "pattern_violation",
          "file": "src/tools/roslyn-analyzers/evaluation/llm/prompts",
          "recommendation": "Add {{ evidence }} placeholder to prompt templates"
        },
        {
          "severity": "info",
          "rule_id": "OBSERVABILITY_ENFORCED",
          "message": "Evaluation orchestrator does not reference observability/tracing",
          "category": "pattern_violation",
          "file": "src/tools/roslyn-analyzers/evaluation/llm/orchestrator.py",
          "recommendation": "Integrate shared.observability for LLM interaction logging"
        }
      ]
    },
    {
      "dimension": "blueprint_alignment",
      "weight": 0.15,
      "status": "pass",
      "score": 4,
      "findings": [
        {
          "severity": "info",
          "rule_id": "BLUEPRINT_HAS_EVAL_DATA",
          "message": "BLUEPRINT Evaluation section has no numeric data (scores, percentages)",
          "category": "placeholder_content",
          "file": "src/tools/roslyn-analyzers/BLUEPRINT.md",
          "recommendation": "Populate Evaluation section with actual metric data"
        }
      ]
    }
  ],
  "summary": {
    "total_findings": 3,
    "by_severity": {
      "error": 0,
      "warning": 0,
      "info": 3
    },
    "overall_status": "STRONG_PASS",
    "overall_score": 4.65,
    "dimensions_reviewed": 5
  }
}
