{
  "review_id": "bc44ba40-f76d-46ac-9304-388c667f5051",
  "timestamp": "2026-02-13T19:16:31.866906+00:00",
  "target": "git-sizer",
  "review_type": "tool_implementation",
  "dimensions": [
    {
      "dimension": "entity_persistence_pattern",
      "weight": 0.2,
      "status": "pass",
      "score": 5,
      "findings": []
    },
    {
      "dimension": "output_schema_envelope",
      "weight": 0.2,
      "status": "pass",
      "score": 4,
      "findings": [
        {
          "severity": "info",
          "rule_id": "ANALYZE_PATH_NORM",
          "message": "analyze.py does not import path normalization utilities",
          "category": "missing_requirement",
          "file": "src/tools/git-sizer/scripts/analyze.py",
          "recommendation": "Import from shared.path_utils or common.path_normalization"
        }
      ]
    },
    {
      "dimension": "code_conventions",
      "weight": 0.15,
      "status": "pass",
      "score": 5,
      "findings": []
    },
    {
      "dimension": "evaluation_infrastructure",
      "weight": 0.15,
      "status": "pass",
      "score": 4,
      "findings": [
        {
          "severity": "info",
          "rule_id": "PROMPT_EVIDENCE",
          "message": "Prompts missing '{{ evidence }}' placeholder: ['threshold_quality.md', 'actionability.md', 'size_accuracy.md', 'integration_fit.md']",
          "category": "pattern_violation",
          "file": "src/tools/git-sizer/evaluation/llm/prompts",
          "recommendation": "Add {{ evidence }} placeholder to prompt templates"
        }
      ]
    },
    {
      "dimension": "blueprint_alignment",
      "weight": 0.15,
      "status": "pass",
      "score": 4,
      "findings": [
        {
          "severity": "info",
          "rule_id": "BLUEPRINT_HAS_EVAL_DATA",
          "message": "BLUEPRINT Evaluation section has no numeric data (scores, percentages)",
          "category": "placeholder_content",
          "file": "src/tools/git-sizer/BLUEPRINT.md",
          "recommendation": "Populate Evaluation section with actual metric data"
        }
      ]
    }
  ],
  "summary": {
    "total_findings": 3,
    "by_severity": {
      "error": 0,
      "warning": 0,
      "info": 3
    },
    "overall_status": "STRONG_PASS",
    "overall_score": 4.41,
    "dimensions_reviewed": 5
  }
}
