{
  "review_id": "e3c79773-fcdd-4f2f-b09e-64e05ed92399",
  "timestamp": "2026-02-13T19:13:54.220126+00:00",
  "target": "semgrep",
  "review_type": "tool_implementation",
  "dimensions": [
    {
      "dimension": "entity_persistence_pattern",
      "weight": 0.2,
      "status": "pass",
      "score": 5,
      "findings": []
    },
    {
      "dimension": "output_schema_envelope",
      "weight": 0.2,
      "status": "pass",
      "score": 5,
      "findings": []
    },
    {
      "dimension": "code_conventions",
      "weight": 0.15,
      "status": "pass",
      "score": 5,
      "findings": []
    },
    {
      "dimension": "evaluation_infrastructure",
      "weight": 0.15,
      "status": "pass",
      "score": 5,
      "findings": []
    },
    {
      "dimension": "blueprint_alignment",
      "weight": 0.15,
      "status": "pass",
      "score": 5,
      "findings": []
    }
  ],
  "summary": {
    "total_findings": 0,
    "by_severity": {
      "error": 0,
      "warning": 0,
      "info": 0
    },
    "overall_status": "STRONG_PASS",
    "overall_score": 5.0,
    "dimensions_reviewed": 5
  }
}
